{
  "schema_version": "1.1.0",
  "profiles": ["session_auto", "session_explicit", "routine_auto"],
  "rerank": "off",
  "notes": [
    {
      "expected_id": "notes/common-meeting-room-booking",
      "title": "Common Meeting Room Booking",
      "description": "Shared office note used as low-signal link filler",
      "body": "Book shared rooms through the calendar and cancel unused slots the day before so other teams can use them. Rooms with video units are reserved for calls with more than four remote participants.",
      "tags": ["retrieval-profile"],
      "authority": { "namespace": "knowledge", "role": "canonical", "status": "active", "scope": "px/common-meeting-room-booking" }
    },
    {
      "expected_id": "notes/common-travel-request-form",
      "title": "Common Travel Request Form",
      "description": "Shared office note used as low-signal link filler",
      "body": "Submit travel requests two weeks ahead with the destination, purpose, and estimated cost. Late requests need a manager note and are settled at the standard rate only.",
      "tags": ["retrieval-profile"],
      "authority": { "namespace": "knowledge", "role": "canonical", "status": "active", "scope": "px/common-travel-request-form" }
    },
    {
      "expected_id": "notes/common-laptop-setup-guide",
      "title": "Common Laptop Setup Guide",
      "description": "Shared office note used as low-signal link filler",
      "body": "New laptops get full-disk encryption, the password manager, and the VPN client on the first day. Return the loaner unit within a week of receiving the permanent machine.",
      "tags": ["retrieval-profile"],
      "authority": { "namespace": "knowledge", "role": "canonical", "status": "active", "scope": "px/common-laptop-setup-guide" }
    },
    {
      "expected_id": "notes/common-visitor-badge-rules",
      "title": "Common Visitor Badge Rules",
      "description": "Shared office note used as low-signal link filler",
      "body": "Visitors sign in at reception, wear a badge at all times, and are escorted inside secure areas. Badges are returned at departure and reprinted for each visit.",
      "tags": ["retrieval-profile"],
      "authority": { "namespace": "knowledge", "role": "canonical", "status": "active", "scope": "px/common-visitor-badge-rules" }
    },
    {
      "expected_id": "notes/common-printer-maintenance",
      "title": "Common Printer Maintenance",
      "description": "Shared office note used as low-signal link filler",
      "body": "Replace toner when the panel warns and write paper jams in the shared sheet. The facilities team services every printer on the first Wednesday of the month.",
      "tags": ["retrieval-profile"],
      "authority": { "namespace": "knowledge", "role": "canonical", "status": "active", "scope": "px/common-printer-maintenance" }
    },
    {
      "expected_id": "notes/common-holiday-calendar",
      "title": "Common Holiday Calendar",
      "description": "Shared office note used as low-signal link filler",
      "body": "Office holidays follow the national calendar plus two company holidays in August. Teams with on-call duty swap the company holidays for a weekday of their choice.",
      "tags": ["retrieval-profile"],
      "authority": { "namespace": "knowledge", "role": "canonical", "status": "active", "scope": "px/common-holiday-calendar" }
    },
    {
      "expected_id": "notes/common-desk-booking-etiquette",
      "title": "Common Desk Booking Etiquette",
      "description": "Shared office note used as low-signal link filler",
      "body": "Book a desk before arriving and release it if plans change. Leave the desk clear at the end of the day so cleaning staff can wipe every surface.",
      "tags": ["retrieval-profile"],
      "authority": { "namespace": "knowledge", "role": "canonical", "status": "active", "scope": "px/common-desk-booking-etiquette" }
    },
    {
      "expected_id": "notes/common-coffee-machine-care",
      "title": "Common Coffee Machine Care",
      "description": "Shared office note used as low-signal link filler",
      "body": "Descale the machine monthly and refill beans from the pantry stock. Report a blinking service light to facilities instead of pressing the reset button repeatedly.",
      "tags": ["retrieval-profile"],
      "authority": { "namespace": "knowledge", "role": "canonical", "status": "active", "scope": "px/common-coffee-machine-care" }
    },
    {
      "expected_id": "notes/common-parking-allocation",
      "title": "Common Parking Allocation",
      "description": "Shared office note used as low-signal link filler",
      "body": "Parking spaces change hands quarterly among teams and bicycles use the basement racks. Visitors park in the two marked bays next to the entrance.",
      "tags": ["retrieval-profile"],
      "authority": { "namespace": "knowledge", "role": "canonical", "status": "active", "scope": "px/common-parking-allocation" }
    },
    {
      "expected_id": "notes/common-mailroom-hours",
      "title": "Common Mailroom Hours",
      "description": "Shared office note used as low-signal link filler",
      "body": "The mailroom is open from nine to five and packages are held for 72 hours. Outgoing parcels need the cost centre written on the label.",
      "tags": ["retrieval-profile"],
      "authority": { "namespace": "knowledge", "role": "canonical", "status": "active", "scope": "px/common-mailroom-hours" }
    },
    {
      "expected_id": "notes/common-lost-and-found",
      "title": "Common Lost and Found",
      "description": "Shared office note used as low-signal link filler",
      "body": "Lost items are kept at reception for one month and then donated. Valuables are locked in the cabinet and released only with a matching description.",
      "tags": ["retrieval-profile"],
      "authority": { "namespace": "knowledge", "role": "canonical", "status": "active", "scope": "px/common-lost-and-found" }
    },
    {
      "expected_id": "notes/common-wellness-program",
      "title": "Common Wellness Program",
      "description": "Shared office note used as low-signal link filler",
      "body": "The wellness program offers gym discounts and quarterly health checks. Enrolment opens in January and again in July for new joiners.",
      "tags": ["retrieval-profile"],
      "authority": { "namespace": "knowledge", "role": "canonical", "status": "active", "scope": "px/common-wellness-program" }
    },
    {
      "expected_id": "notes/common-library-loans",
      "title": "Common Library Loans",
      "description": "Shared office note used as low-signal link filler",
      "body": "Library books can be borrowed for four weeks and extended once. Reference volumes stay in the reading corner and are not lent out.",
      "tags": ["retrieval-profile"],
      "authority": { "namespace": "knowledge", "role": "canonical", "status": "active", "scope": "px/common-library-loans" }
    },
    {
      "expected_id": "notes/common-kitchen-cleaning-rota",
      "title": "Common Kitchen Cleaning Rota",
      "description": "Shared office note used as low-signal link filler",
      "body": "Kitchen cleaning follows the weekly rota posted on the fridge. The last person leaving on Friday empties the dishwasher and takes out the recycling.",
      "tags": ["retrieval-profile"],
      "authority": { "namespace": "knowledge", "role": "canonical", "status": "active", "scope": "px/common-kitchen-cleaning-rota" }
    },
    {
      "expected_id": "notes/common-supply-cabinet",
      "title": "Common Supply Cabinet",
      "description": "Shared office note used as low-signal link filler",
      "body": "Stationery is in the supply cabinet; write what you take on the clipboard. Bulk orders go through the office manager once a month.",
      "tags": ["retrieval-profile"],
      "authority": { "namespace": "knowledge", "role": "canonical", "status": "active", "scope": "px/common-supply-cabinet" }
    },

    {
      "expected_id": "notes/lumen-restore-drill",
      "title": "Lumen Restore Drill",
      "description": "Routine companion record",
      "body": "Restore drill result for the lumen media set: restore time 42 minutes, verification passed, media ID L-0418.",
      "tags": ["retrieval-profile"],
      "authority": { "namespace": "records", "role": "record", "status": "active", "scope": "px/lumen-restore-drill" }
    },
    {
      "expected_id": "notes/lumen-backup-rotation",
      "title": "Lumen Backup Rotation",
      "description": "Routine procedure under test",
      "body": "Lumen backup rotation runs every Monday. Rotate the weekly media set, run the restore drill, and note the media ID in the drill record: [lumen restore drill](/notes/lumen-restore-drill.md).",
      "tags": ["retrieval-profile"],
      "authority": { "namespace": "procedures", "role": "canonical", "status": "active", "scope": "px/lumen-backup-rotation" }
    },
    {
      "expected_id": "notes/sable-certificate-inventory",
      "title": "Sable Certificate Inventory",
      "description": "Routine companion record",
      "body": "Inventory of sable certificates with expiry dates, issuing chain, and the node each one is installed on.",
      "tags": ["retrieval-profile"],
      "authority": { "namespace": "records", "role": "record", "status": "active", "scope": "px/sable-certificate-inventory" }
    },
    {
      "expected_id": "notes/sable-certificate-renewal",
      "title": "Sable Certificate Renewal",
      "description": "Routine procedure under test",
      "body": "Sable certificate renewal happens thirty days before expiry. Request the new chain, install it on both edge nodes, and update the inventory: [sable certificate inventory](/notes/sable-certificate-inventory.md).",
      "tags": ["retrieval-profile"],
      "authority": { "namespace": "procedures", "role": "canonical", "status": "active", "scope": "px/sable-certificate-renewal" }
    },
    {
      "expected_id": "notes/corvid-quota-table",